{
  "schemaVersion": 1,
  "baseline": {
    "tag": "baseline-v0.2.0",
    "commit": "9355032ecadd6d3c940d7977fe381f9f8a93b1ab"
  },
  "artifact": {
    "kind": "directory-content-sha256-v1",
    "revision": "decisionharbor-v0.2.0-hidden-harness-v1",
    "sha256": "c4b892d048b1f3fc1d1821dacad8f74aae4700e3f02565067b914b3989a1bbff"
  },
  "entrypoint": "hidden-harness/run --api-url <api-url>",
  "environment": {
    "python": "3.10.12",
    "dockerEngine": "29.1.3",
    "dockerCompose": "2.40.3+ds1-0ubuntu1~22.04.1",
    "networkBoundary": "loopback-only candidate endpoints",
    "scenarioProtocol": "hidden-harness/scenarios.md"
  },
  "coverage": [
    "health and readiness envelopes",
    "submission policy and idempotency",
    "polling terminal lifecycle and result snapshots",
    "history pagination validation",
    "terminal retry and cancellation rules",
    "SQL catalog cast regression",
    "two-worker ownership capacity",
    "lease takeover and generation fencing",
    "automatic attempt classification and limit",
    "cancellation convergence and publication races",
    "result byte row type and retention boundaries",
    "idempotent cleanup and audit retention",
    "database permissions and fixed dataset regression",
    "Compose isolation and restart recovery"
  ],
  "candidateAccess": false,
  "frozenAt": "2026-08-22T21:14:45+08:00",
  "notes": [
    "Artifact hash covers the five ordinary files under hidden-harness using the method documented in hidden-harness/README.md.",
    "The HTTP runner uses only public endpoints; scenarios requiring fault injection use candidate-provided observable seams without standardizing internal implementation.",
    "The original synchronous baseline produced three expected contract failures, confirming that the runner distinguishes v0.1 behavior from the v0.2 contract."
  ]
}
